Name,Org,Pos,Current Level,Top 100,Org Rk,Trend,FV,ETA,Risk,Age,Ht,Wt,B,T,Sign Yr,Sign Mkt,Sign Org,Bonus,Signed From,Report,Video,playerId
"Jeremy Pena","HOU","SS","AAA",67,1,,"50",2022,"Med","23.7027777","6' 0""","180","R","R",2018,"Draft","HOU",535000,"Maine","Billed as the best collegiate defensive player in the 2018 Draft, Peña has since added 20 pounds of muscle and now has modest, but relevant power. After looking uncharacteristically mistake-prone during the 2019 Fall League, he was the Dominican Winter League's best infield defender in 2020 and should be a plus big league defender at shortstop. While he isn't as deft and precise with the barrel, Peña's swing shares some common rotational elements with fellow Astro Yuli Gurriel. Peña can pull his hands in and get the fat part of the bat on pitches on the inner half, which should enable him to hit 12 to 15 annual pull shots, maybe a couple more because of the Crawford Boxes in Houston. But the profile foundation here is Peña's on-base ability and plus glove at a premium position. He's 23 and hasn't played above A-ball, but is still a pretty stable prospect, in part thanks to his coming of age in LIDOM. <em>(Alternate site, Fall Instructional League, LIDOM)</em>","YRrhsdBsxBo","sa876320"
"Hunter Brown","HOU","SP","AA",119,2,,"50",2023,"Med","22.7666666","6' 2""","212","R","R",2019,"Draft","HOU",325000,"Wayne State","Brown is one of several pitchers who blew up during the 2020 Fall Instructional League in Florida. He was often up to 99 at the alt site and sat in the mid-90s during instructs while incorporating a good slider and a rebooted curveball (Brown shelved it in college but it has now been reintroduced in pro ball, and is already better than the slider). Both breaking balls have impact potential. There are some similarities with the way Walker Buehler's stuff changed when he first returned from Tommy John. Brown had a long layoff (though it was because of the pandemic rather than a TJ) and returned with more velo and two good breaking balls rather than just one. 
Brown's uptick in stuff has coincided with a change in his physicality, as he's clearly taking advantage of pro strength programs and facilities (remember, this guy comes out of a Division II school). The change in his physique lends credence to the uptick in stuff, though there's still relief risk here because we haven't seen Brown hold it for a whole season as a starter and he was wild during his brief 2021 big league spring training work. He has a chance to take yet another leap in 2021, especially in an org that is very good at developing pitchers. <em>(Alternate site, Fall Instructional League)</em>",,"sa3010571"
"Jairo Solis","HOU","SP","AAA",,3,,"45+",2022,"High","21.4527777","6' 2""","205","R","R",2016,"J2","HOU",450000,"Venezuela","Solis had Tommy John late in the summer of 2018, so he didn't pitch at all in 2019. He was a Pick to Click after the 2019 season in anticipation of him exploding when he returned from rehab, but because of COVID, he didn't pitch until the fall, only returning for 2020 instructs. Scouts who have covered Houston the last couple of years count Solis among the most talented pitchers in the org and think he has as much upside as guys like Forrest Whitley and Bryan Abreu, if not more. He came out during 2021 spring training sitting 93-97 and during the course of four total innings against big leaguers, garnered at least one swing-and-miss with each of his pitches. He also struggled badly with his mechanical consistency and command, and the Mets varsity lineup shelled him. But remember that Solis is still just a 21-year-old who has barely pitched the last two years. If you line up his broad strokes age/stuff quality/relief-risk profile, it lines up pretty closely to LSU prospect Jaden Hill, who entered the 2021 season as a likely top 10 draft pick (he recently blew out). Solis should be close to a healthy Hill on the FV continuum. 
In addition to the mid-90s heat with vertical action, Solis has a power pitcher's overhand curveball to go with a firm, upper-80s slider and changeup. The movement he creates on the slider and changeup is mediocre-looking (note also that his 2021 spring spin rates, per Savant, were below my sourced numbers from 2018) but their shapes deviate enough from his fastball/curveball combo that they play well when located, which doesn't happen regularly yet. The fastball/curveball, meanwhile, have more margin for error due to sheer nastiness. While Solis has filled out during the last couple of years, his lower half is still weak, which impacts his delivery's consistency and his command. If the command piece can be ironed out, Solis has a mid-rotation future. If not, it lies in high-leverage relief. <em>(Fall Instructional League)</em>",,"sa3003037"
"Korey Lee","HOU","C","A+",,4,,"45",2023,"High","22.8611111","6' 2""","210","R","R",2019,"Draft","HOU",1750000,"Cal","Lee has a great baseball player's frame and superlative athleticism for most positions, let alone catcher. His mobility and plus-plus arm make him a potential impact defender there, and he may end up playing other positions, too. The Astros gave him some reps in the outfield after he signed in 2019, and Lee had amateur experience at several infield positions. He's currently catching on one knee, with his hands working from the ground up as he tries to frame fastballs at the bottom of the zone. While one-knee'd catching can create problems for some guys as they exit their crouch to throw, it's not a problem for Lee, who explodes out of his stance and maintains sound footwork that helps enable arm accuracy. 
He doesn't have a long track record with the bat, however. Yes, Lee hit .320/.420/.626 as a junior at Cal but he didn't perform anywhere near that level as an underclassman and hasn't really had an opportunity to reinforce that line in pro ball because the pandemic washed away what would have been his first full season. Pro scouts who saw him in 2019 after the draft thought his swing was long, sweeping downward in an unimpactful way, and also thought he struggled to recognize breaking balls. His 2020 instructs and 2021 spring training looks were much stronger than that, though, which seems to have coincided with a change to Lee's swing. He's eliminated a big leg kick and simplified his footwork. His rare physical ability combined with the low industry inventory at the catcher position makes him a potential everyday player if the swing change helps make him an even average all-around offensive player. <em>(Alternate site, Fall Instructional League)</em> ",,"sa3010034"
"Luis Garcia","HOU","SP","MLB",,5,,"45",2021,"Med","24.4777777","6' 1""","244","R","R",2017,"J2","HOU",20000,"Venezuela","Of the many hard-throwing young 20-somethings who occupied the thick middle of this list a few years ago, Garcia is the one whose touch-and-feel command really emerged. He's now a lock to remain a starter and will likely play an integral role in Houston's rotation going forward. During the course of a start, he'll typically sit in the 90-94 range and touch as high as 96 while working an awful lot to his glove side with the heater and his two very distinct breaking balls. Both Garcia's slider/cutter and curveball are average, though his slider has a little more lateral movement than it did in 2020, so maybe that pitch is above now. It's his tailing mid-80s changeup that has the nastiest action, and the best chance to finish big league hitters. 
Garcia was a 32% strikeout, 11% walk rate guy in the minors, including his most recent full season in 2019, the only time in his pro career he's exceeded 100 innings. He no longer looks like the sort of pitcher who'll produce peripherals like that over a full season and I'd expect both of those rate stats to fall. The lack of a short- and long-term workload track record and the leap Garcia might be asked to make in a rotation coming off a short 2020 create some extra volatility here, but Garcia's arm action is so loose and his lower half is so robust and strong that it might be less of an issue for him than it would be for others. He projects as a big-league ready No. 4/5 starter who'll produce in the 1.5 to 2 WAR range. <em>(Alternate site, MLB)</em>",,"23735"
"Bryan Abreu","HOU","SIRP","MLB",,6,,"45",2021,"High","24.1194444","6' 1""","225","R","R",2013,"J2","HOU",40000,"Dominican Republic","Because he has premium arm strength and both of his breaking balls are nasty benders from hell -- they're roughly the same velocity but have clearly different shapes -- Abreu has elite reliever ceiling. His complete lack of fastball control forces him to work with those breaking balls early in counts, which impacts hitters' willingness to offer at them later in at-bats as they've already seen a couple. Houston had him semi-stretched out as a starter during 2021 spring training but he's almost certain to wind up in single-inning relief, where he could become a closer. It's more likely he becomes a righty version of José Alvarado, providing viral GIF fodder at times while raising the blood pressure of Astros fans at others. <em>(Alternate site)</em>",,"16609"
"Pedro Leon","HOU","SS/CF",,,7,,"45",2025,"High","23.0194444","5' 9""","200","R","R",2021,"J2","HOU",4000000,"Cuba","A 5-foot-9 stick of dynamite, Leon has a big power/speed/arm tool trinity. Until 2021 Spring Training, the last action Leon saw was during the 2018-19 Cuban National Series, in which he homered 15 times in 30 games before dealing with an oblique injury. He was cleared to sign last December but an oblique injury moved back his workout. When it was finally held, teams got a text on the way there saying that Leon had a deal with Houston already done.  The shoulder is healthy and with his power, elite arm strength, and incredible bat speed from the right side, Leon is the sort of player who would have prompted teams to burst through their bonus pool when they weren't hard-capped. The success rate of Cuban hitters, especially ones who have had a long time away from baseball during their relocation process and pre-eligibility period, is highly variable, but Leon looked pretty comfortable against big league pitching during 2021 Spring Training, and he squared good velocity several times. The Astros plan on experimenting with him at shortstop and in center field. He's a very interesting and talented prospect with a chance to be an impact player. <em>(International signee)</em>",,
"Colin Barber","HOU","CF","A+",,8,,"45",2024,"Med","20.5027777","6' 0""","194","L","L",2019,"Draft","HOU",1000000,"Pleasant Valley HS (CA)","Barber is a sweet-swinging lefty outfield stick with really advanced bat-to-ball skills. He's also gotten considerably stronger since high school even though he didn't have an overtly projectable frame, and while he may not have gargantuan power, he might outproduce his raw power grade in games because his feel for contact is so good. He went to the alt site very late in the year then had an impressive instructs, where he not only raked but also posted plus run times. The same source who collected those plus run times has a left field projection on Barber due to a lack of arm strength, and his hit tool will likely need to help amplify the power for him to profile as a true everyday player there. I have a slightly higher degree of confidence in Barber doing this since he's a strong, short-levered hitter and those guys' hit tools seem to max out more consistently than their longer counterparts. <em>(Alternate site, Fall Instructional League)</em> ",,"sa3010696"
"Peter Solomon","HOU","SP","AAA",,9,,"40+",2021,"High","24.8027777","6' 4""","211","R","R",2017,"Draft","HOU",420000,"Notre Dame","Solomon had strike-throwing issues in college and Notre Dame had several other talented, more consistent (at the time) pitchers, so he spent most of his time there in a multi-inning relief role. By the time he had finished his first full season in pro ball, Solomon had started as many games as he had his entire college career while only working about four innings per outing in Houston's piggyback development style. Off to a very fast start in 2019, Solomon blew out and needed Tommy John surgery. Even as he rehabbed over the next two seasons (only returning for 2020 instructs), he was asked about in trades and seemingly continued to hone starter-worthy command during rehab. He looked great during 2021 spring training, sitting 93-94 with carry and working with a plus changeup. Both of Solomon's breaking balls are about average and have glove-side utility. What kind of workload he'll be able to sustain remains a question, since not only is Solomon coming off a TJ but he's also never thrown more than 100 innings in a season when healthy. His stuff looks like that of a No. 4/5 starter, though. <em>(Fall Instructional League)</em>",,"20476"
"Tyler Ivey","HOU","MIRP","AAA",,10,,"40+",2021,"High","25.0638888","6' 4""","195","R","R",2017,"Draft","HOU",450000,"Grayson County JC (TX)","Ivey's violent head whack, some minor injury stuff, and the lack of an innings foundation -- caused partially by a 2019 suspension, the official reason for which was initially undisclosed, though it was later revealed that he was caught using a foreign substance -- all push him toward the bullpen, but he has starter's stuff. His fastball plays well at the top of the zone even though it isn't all that hard, and really hasn't been since 2018. His curveball is the headliner, though. It's a gorgeous, old-school 12-to-6 yakker that freezes hitters. He also has a cutter/slider and a changeup, the latter of which shows flashes of bat-missing movement. Everything about Ivey screams multi-inning bullpen weapon. <em>(Alternate site)</em>",,"20237"
"Forrest Whitley","HOU","MIRP","AAA",,11,"&darr;","40+",2022,"High","23.7222222","6' 7""","238","R","R",2016,"Draft","HOU",3148000,"Alamo Heights HS (TX)","As enigmatic as any pitcher in the minors, Whitley's 2020 alternate site performance added to what has been a consistently inconsistent career dating back to high school. He transformed from a soft-bodied pitchability high schooler to a svelte, five-pitch, fire-breathing dragon in the span of about 18 months, then had a 2018 stimulant suspension plus lat and oblique issues before 2019 brought shoulder fatigue, control problems, and what looked like a conditioning regression. Depending on the day, his fastball velocity was anywhere from 91 to 98 at the 2020 alternate site, and he seemed a distant thought even at the end of the year when the big club was clamoring for pitching. 
Spring of 2021 arrived and by mid-March, Whitley needed Tommy John. If there's a silver lining, it's that it may gives him the opportunity to rebuild and fine tune his body, which is common for TJ rehab guys. It's possible we'll once again see Whitley sitting 94-97 with a bevy of elite secondary offerings, but I'd be surprised if he's able to do that year after year for a half decade based on how unfortunate his health-related track record has been so far. <em>(Alternate site)</em>","5krfMUxyV_M","sa917930"
"Freudis Nova","HOU","2B","A+",,12,,"40+",2022,"High","21.3972222","6' 1""","215","R","R",2016,"J2","HOU",1200000,"Dominican Republic","I'm getting some Gilbert Lara flashbacks here, which isn't a good thing. Like Lara, Nova has quickly filled out and morphed from a swing-happy middle infielder with power projection into one with more of a corner look and considerable present power. He's so much bigger and stronger now that some scouts who saw him both last fall and this spring think his ultimate destination may be first base, and that his body has already begun to look like that of late-career Hanley Ramirez. Nova's plus-plus arm may enable him to hide some of what project to be lateral range deficiencies, and he could still end up at third base or playing a Moustakas-y second. 
It puts more pressure on him to develop a better approach than his current, over-aggressive version. Remember though that Nova has performed on paper despite his approach, including a nearly average line as a 19-year-old in the Midwest League back in 2019 that featured 25 extra-base hits in just 75 games. Unlike the Gilbert Lara/Brewers situation, the club here thought highly enough of Nova to put him on their 40-man. The chance for a viable middle infielder with relevant game power still exists here, but is looking less likely as time passes. <em>(Fall Instructional League)</em>",,"sa3003195"
"Shawn Dubin","HOU","SIRP","AAA",,13,,"40+",2022,"Med","25.7472222","6' 1""","170","R","R",2018,"Draft","HOU",1000,"Georgetown College","Dubin took a long route to pro ball (from a JUCO to Buffalo and then to an NAIA school) and his destination will be a big league bullpen. He enjoyed a velo spike in 2019 and dominated low-level competition with mid-90s heat and a really good slider. At the time, Dubin was listed at a dandelionesque 155 pounds but has since climbed up over 170, albeit without seeing any more velo. It might help quell some concerns about his size and durability, though. Dubin was once again mostly 93-96 this spring, folding in an upper-80s slider and mid-80s curveball. One source put a 70 on Dubin's slider. If that's true, then projecting him in a middle relief role here will be light. <em>(Alternate site)</em>",,"sa3007248"
"Jordan Brewer","HOU","CF","A-",,14,,"40",2023,"High","23.8444444","6' 1""","195","R","L",2019,"Draft","HOU",500000,"Michigan","There's an injury update at the end of this blurb, which is otherwise unchanged because of said injuries: Brewer was draft eligible in 2018 at Lincoln Trail JC in Illinois and went unselected, but emerged in his season at Michigan due to his huge tools: solid average raw power, plus-plus speed, plus arm strength and good instincts on the bases. In the 2019 draft, Brewer was an outfielder for the College World Series finalist and arguably had the best raw tools in the draft. But he lasted until the back of the third round due to his rawness at the plate, underlined by his 56 strikeouts to 24 walks. 
At the plate, Brewer's pitch selection is below average and his swing can get long, so the prototypical profile of the below average contact platoon center fielder, like a Jake Marisnick, is the reasonable upside since Brewer is already 23, going on 24, and has barely played during the last two years because of a toe injury, the pandemic, and a knee surgery. <em>(Injury rehab)</em>",,"sa3011737"
"Alex Santos II","HOU","SP",,,15,,"40",2025,"High","19.3194444","6' 4""","194","R","R",2020,"Draft","HOU",1250000,"Mount St. Michael HS (NY)","Santos spins the ball a little better than your typical boiler plate prep pitching prospect and his build allowed for strength and velocity projection while he was a rising junior. At that time, he was sitting in the low-90s, up to 95, and had a 55-grade curveball. Based on his build and geographic location, Santos was one of the high school arms who seemed like they had a chance to have a big uptick in velocity after a winter of training, and maybe leap into the first or second round of the 2020 draft. He looked a little less athletic and loose in his first 2020 start but it was chilly (in the 50s); he showed no real velo uptick and never got a chance to. It moved him from the 40/40+ FV cusp to the 40s, much like Matthew Thompson and Andrew Dalquist the year before. Santos' velo was up during Fall Instructional League, though, where he sat about 94 but also looked a little less projectable and more reliever-ish to scouting sources who saw him there than they had expected given his draft pedigree. <em>(Fall Instructional League)</em>",,"sa3014684"
"Grae Kessinger","HOU","SS","AA",,16,,"40",2022,"Med","23.7777777","6' 2""","204","R","R",2019,"Draft","HOU",750000,"Ole Miss","Kessinger is a classic low-variance SEC utility guy with elite baseball instincts and makeup. He's not very toolsy and both his contact ability and power will likely end up shy of average at maturity, but his ability to do literally everything else well will probably enable him to play in the big leagues for a decade, and Houston gave him reps all over the infield during his first pro summer. Unlike many 2019 college draftees who need to come out of the gate hot with the bat in 2021, Kessinger's need only hover around that 90 wRC+ realm to continue projecting in this role. <em>(Fall Instructional League)</em>",,"sa3010327"
"Nivaldo Rodriguez","HOU","SP","MLB",,17,,"40",2021,"Low","24.1361111","6' 1""","170","R","R",2015,"J2","HOU",10000,"Venezuela","Rodriguez was 95-98 on the TV radar gun during a spring training game against Washington, but those readings appear to have been faulty, as he sat in the low-90s in 2019 and '20, and during his other starts at locations with pitch tracking this spring. That's still nothing to sneeze at, as Rodriguez's backspinning heater plays a little bit above its velocity due to its carry at the top of the zone. Though he doesn't have precise command, Rodriguez lives in and around the zone with all four of his pitches, the best of which is a low-80s curveball with vertical depth and action that complements his fastball well. He also has an upper-80s cutter/slider and a changeup, both of which are just shy of average. The entire package is that of a fifth starter or long man, and Rodriguez is likely to be up pretty frequently in 2021. <em>(Alternate site, MLB)</em>",,"22449"
"Chas McCormick","HOU","RF","MLB",,18,,"40",2021,"Med","26.1277777","6' 0""","190","R","L",2017,"Draft","HOU",1000,"Millersville","McCormick projects to play a role similar to the one Jordan Luplow has played in Pittsburgh: a part-time, lefty-mashing corner outfielder. He is the Pennsylvania State Athletic Conference's all-time hits leader and tweaked his swing over the course of his first two full seasons in pro ball (his stance and stride direction have changed), which helped him lift the ball more consistently. He now strides closed, and he's able to cover the outer half of the plate really well because of this. McCormick performed statistically up through Triple-A amid some pretty aggressive promotions and his proprietary expected stats from the 2019 minors were actually better than his triple slash line. He's a low-variance role player. <em>(Alternate site, LIDOM)</em>",,"19599"
"Dauri Lorenzo","HOU","SS",,,19,,"40",2025,"High","18.6","6' 1""","165","S","R",2019,"J2","HOU",1800000,"Dominican Republic","Lorenzo got just south of $2 million on the IFA market a couple of years ago and was the youngest Astros prospect in their entire 2020 Instructional League camp. He's already become very physical, so much so that there's early concern he won't be able to stay at shortstop. Second base was already squarely in the picture here, as Lorenzo's arm is not a slam dunk for the left side of the infield. Switch-hitting middle infielders are hard to come by, though, and Lorenzo is short to the ball and his swing has lift, which is also rare. His early career path makes it more important that a well-rounded contact/power combination emerge from the offensive skill set since second base looks more like his eventual home, but the physical ability to clear that offensive bar appears to be here. <em>(Fall Instructional League)</em>","3-AlAH2un18","sa3014685"
"Misael Tamarez","HOU","SP","A",,20,,"40",2024,"High","21.3861111","6' 1""","206","R","R",2018,"J2","HOU",,"Dominican Republic","Tamarez had interesting 2019 pitch data (a 19-year-old topping out at 93 with plus cut and carry), but I had nothing else to go on at the time (not even video) so he didn't make last year's list. He had a strong showing at 2020 instructs, where Tamarez's fastball was more often parked at 93 rather than just peaking near there. He's also an above-average athlete with a precocious changeup. A scout who saw instructs has also been impressed by Tamarez's on-field maturity and what looked to them like strong work habits. That scout thinks Tamarez belongs ahead of Santos here. Of the young 40-FV-and-below arms who may yet continue to emerge in this system, Tamarez either has better stuff or is a more starter-y looking athlete than the others. He's a high-priority full-season follow for 2021. <em>(Fall Instructional League)</em>   ",,"sa3009632"
"Zach Daniels","HOU","CF",,,21,,"40",2024,"High","22.3666666","6' 1""","211","R","R",2020,"Draft","HOU",,"Tennessee","It's not as if hitting prospects with huge power and severe strikeout issues are rare, but what <em>is</em> rare is that Daniels barely performed in college but is still seen as a guy with huge power potential. In part due to injuries and then the pandemic, Daniels never played more than 35 games in a college season and never homered more than five times in a single campaign. He struck out roughly 40% of the time combined between his underclass seasons at Tennessee and the wood bat summer ball he played amid them, then exploded during non-conference play in 2020, walking as much as he struck out while slashing .357/.478/.750 for four short weeks. 
He draws some Giancarlo Stanton swing comps because of his closed stance/stride and tucked hands, and Daniels' raw power is only a grade shy of Stanton's. Daniels can also really run and has the Michael Vick, sportscar forward tilt and posture as he does. He'll run some plus times straight through the bag and some 70-grade times with the turn on his way to second base. The bust probability here is high because the track record for college hitters striking out this much and succeeding is very sparse, but guys with this kind of power/speed combo don't exactly grow on trees. <em>(Fall Instructional League)</em>",,
