"Austin Hansen","HOU","SIRP","AAA",,22,,"40",2021,"Low","24.7777777","6' 0""","204","R","R",2018,"Draft","HOU",,"Oklahoma","Raise your hand if you had <em>this</em> Hansen as the Oklahoma pitching product most likely to make a big league impact. Hansen has three distinct pitches but his grip-it-and-rip-it mode of attack fits in the bullpen. He'll show you 94-95 with the heater and work his 82-86 mph, two-plane slurve pretty consistently to his glove side despite the high-effort delivery. Every once in a while you'll get an above-average, mid-80s changeup from Hansen, too. He's a near-ready middle relief prospect. <em>(Fall Instructional League)</em>",,"sa3006956"
"Jojanse Torres","HOU","SIRP","AAA",,23,,"40",2022,"High","25.8361111","6' 2""","175","R","R",2017,"J2","HOU",150000,"Dominican Republic","Torres signed with Milwaukee back in 2015 but his deal was voided due to identity falsification. He re-emerged in 2018 with Houston and had a breakout '19 when he suddenly became part of the exciting contingent of young arms from which Cristian Javier and Enoli Paredes have already emerged. While he has one of the harder fastballs in this entire system, I've seen Torres throw his slider much more than his fastball in person, as it seems he can put it in the zone more consistently than his heater, which hums in at 94-98. Even though Torres' slider has good-looking length and tilts in at unusually-high velocities for a slider that bends like his does, hitters don't offer at it very often, and this was especially true of big league hitters this spring. In about 60 pitches on tape, Torres generated just three swings and misses, two on his fastball and one on his changeup. The raw stuff here looks like it belongs in a high-leverage role, but the way it seems to be playing appears to push it toward a lesser, middle-inning one. <em>(Alternate site)</em>",,"sa3006955"
"Luis Santana","HOU","2B","A+",,24,,"40",2022,"Med","21.875","5' 8""","198","R","R",2016,"J2","NYM",200000,"Venezuela","Santana has become pretty polarizing. I've had some sources NP him (as in, they consider him a non-prospect) while others still think his bat-to-ball skill is a carrying tool. I've had some knock his makeup and coachability while others like his swagger and individuality. For a thick, projectionless guy, his exit velos from 2019 are concerningly low. He needs to be a 60 or 70 bat to profile as an everyday second baseman because he's unlikely to hit for power or be a very good defensive player, and it's just much more likely that he ends up in some kind of bench role. The bat-first infielders who tend to end up hopping around to different orgs in these roles (think Brad Miller, Wilmer Flores) almost always have more power than Santana, with those guys outnumbering the punchless Sogard types pretty handily. <em>(Fall Instructional League)</em>",,"sa921577"
"Jose Alberto Rivera","HOU","SIRP","A+",,25,,"35+",2021,"Med","24.3083333","6' 3""","170","R","R",2016,"J2","HOU",10000,"Dominican Republic","The Angels selected Jose Alberto Rivera in the Rule 5 but, even though he threw just one spring inning, they returned him to the Astros because he didn't throw enough strikes to stick in their bullpen. He sat 97 and touched 100 in 2019, and both his breaking ball and changeup are potential swing-and-miss offerings. He may have been less likely to stick with the Angels than he would have been elsewhere given their desire to compete immediately rather than deal with potential wildness (as compared to Yohan Ramirez the year before, who went to a team willing to put up with it to roster him long-term). He is not on the 40-man but may still make a 2021 debut if the club deals with a rash of injuries. <em>(Fall Instructional League)</em> ",,"sa3003090"
"Tyler Brown","HOU","SIRP","A+",,26,,"35+",2024,"Med","22.675","6' 4""","242","R","R",2020,"Draft","HOU",577000,"Vanderbilt","Brown was mostly 91-93 during the abbreviated 2020 college season but was more 92-95 the season before, when he struck out 65 and walked just nine in 49 innings of relief work. If he can reclaim that comfy mid-90s range, he is very likely to be a quick-moving middle relief piece with a vertical action fastball/curveball combo. <em>(At-home dev)</em>",,"sa3014450"
"Jairo Lopez","HOU","SP","A-",,27,,"35+",2022,"High","20.5388888","5' 11""","220","R","R",2017,"J2","HOU",300000,"Venezuela","Lopez has a long, somewhat violent arm action and he's small, but he's a plus athlete with a really quick arm and advanced pitchability for his age. He also has a breaking ball that spins in excess of 2,800 rpm. A scout who saw him during the fall of 2020 thinks I'm overstating how messy the delivery is (they described it as ""clean""), so maybe something there has changed for the better. He has a shot to be a backend starter, and has a realistic bullpen fallback due to the arm strength. <em>(Fall Instructional League)</em>",,"sa3005824"
"Angel Macuare","HOU","SP","A+",,28,,"35+",2022,"High","21.2555555","6' 2""","250","R","R",2016,"J2","HOU",695000,"Venezuela","Two things altered Macuare's placement on the list. First, the visual evaluations of him continue to underscore his lack of athleticism. Second, the pitch data that originally put me onto him in a big way (his fastball had among the most vertical movement in the 2019 minors) was likely tainted by a miscalibrated TrackMan unit. A front office person told me over the phone, ""Some of these 2019 readings aren't humanly possible."" But hey, Macuare still has relatively advanced feel for pitching, especially when he's working with his curveball. He's more likely to end up as a depth starter rather than a consistent backend guy. <em>(Fall Instructional League)</em>",,"sa3003039"
"Manny Ramirez","HOU","SIRP","A-",,29,,"35+",2023,"High","21.5388888","5' 11""","215","R","R",2017,"J2","HOU",50000,"Dominican Republic","Ramirez was so wild early in 2019 that the Astros had to send him back to Extended Spring Training to continue his development in a location that didn't impact actual games. He was re-deployed at a short season affiliate later in the summer. He still ended up walking more than a batter per inning, and the 2020 instructs reports indicate that he remains quite wild. Ramirez's velo and breaking ball give him considerable ceiling but he needs to develop at least a full grade of control to even be viable in relief. <em>(Fall Instructional League)</em>",,"sa3004833"
"Brett Conine","HOU","SIRP","AAA",,30,,"35+",2021,"Low","24.6361111","6' 3""","218","R","R",2018,"Draft","HOU",125000,"Fullerton","Conine reached Double-A in 2019, one of the three levels at which he pitched that year, amassing 134 strikeouts in 114 innings in time mostly spent at Hi-A Fayetteville. He doesn't throw all that hard, only sitting 90-93, and Conine actually sat more in the upper-80s during his 2021 spring debut. But he pounds the zone with his fastball and even though it isn't that hard, it still generated a 16% swinging strike rate in the minors in 2019 thanks to Conine's command and his heater's plus vertical movement. He also locates his (below-average) slider very consistently and has a great changeup. The velocity piece of the puzzle feels a little bit precarious based on the early spring look, but otherwise Conine is big league rotation depth right now. <em>(Alternate site)</em>",,"sa3008024"
"Juan Pablo Lopez","HOU","SP","A+",,31,,"35+",2022,"Med","22.3","6' 4""","216","L","L",2016,"J2","HOU",100000,"Mexico","Juan Pablo Lopez is a pretty standard spot starter/swingman prospect. He's a hulking guy with a big, sturdy frame and a messy delivery that doesn't prevent him from throwing strikes. As an Astros minor leaguer, he has thus far worked in three- or four-inning outings either as a starter or out of the bullpen, while he's pitched exclusively in relief for los Tomateros de Culiacán in the Mexican Pacific League. He'll sit about 92 with tough downhill plane and mix in an average upper-70s curveball and changeup. <em>(Fall Instructional League, Mexican Pacific Winter League)</em>",,"sa3004647"
"Julio Robaina","HOU","SP","A",,32,,"35+",2022,"High","20.2","5' 11""","170","L","L",2017,"J2","HOU",220000,"Cuba","Robaina was not invited to the Astros' 2020 instructs, so there's nothing new that might alter his report. He's a 50 on-mound athlete with a well-balanced drop and drive delivery that produces an upper-80s fastball (touching 92) with cut and carry from the left side. He also has advanced breaking ball feel and the Astros trusted him enough to take a few turns at Low-A and in the Penn League when they needed him to in 2019. But mostly, I think it's worth keeping tabs on any athletic lefty with a breaking ball. <em>(At-home dev)</em>",,"sa3006817"
"Diosmerky Taveras","HOU","SIRP","A",,33,,"35+",2023,"High","21.7","6' 3""","248","R","R",2017,"J2","HOU",55000,"Dominican Republic","Diosmerky is still a premium arm strength flier type. He was sitting 94-97 as a teenager in the 2019 GCL and was once again in the mid-to-upper-90s during 2020 instructs. Despite his age, Taveras is not a projectable sort; his frame is maxed out and then some. His slider is also still a 40-grade pitch. He has a relief shot, and the eventual quality of his breaking ball will dictate his role. <em>(Fall Instructional League)</em>",,"sa3004872"