"Daniel Johnson","CLE","RF","AAA",,16,,"45",2021,"Med","25.9","5' 10""","185","L","L",2016,"Draft","WAS",325000,"New Mexico State","Does it tell us anything about Johnson's prospects that Cleveland was not willing to give him an extended look in their outfield even though they had one of the least productive jardinero groups in baseball? Johnson will come to spring training poised to compete with Bradley Zimmer, Jake Bauers, Josh Naylor and perhaps Nolan Jones for corner outfield starts against right-handed pitching. He is as tooled-up as any of those players, so gifted that at various points during his minor league career, some scouts and front office personnel have projected him (he was drafted by Washington and traded for Jefry Rodriguez) as an everyday player. The loudest of those tools is Johnson's arm strength, followed by his speed and then, to a lesser extent, above-average raw power that manifests as doubles in games because his swing really only enables home run power to his pull side. Johnson has a career .284/.344/.460 line in the minors and has never produced a batting line below league average as a pro. So given the tools and performance, why isn't he higher on this list? I think big league arms will be able to pitch to him in a way that limits his power output below the corner outfield average and that Johnson's relative lack of defensive instincts make him more of a fit in right field than in center. At one point Johnson was so raw as a hitter that some scouts wanted to see him on the mound, leading me to I hope there would be late development in some of these areas, but now that Johnson is 25, I think he's likely to settle in as a platoon bat. <em>(Alternate site, MLB)</em>","_vyB942sM98","19643"
"Joey Cantillo","CLE","SP","AA",,17,,"45",2022,"Med","21.4638888","6' 4""","220","L","L",2017,"Draft","SDP",302500,"Kailua HS (HI)","He was a Pick to Click of mine last offseason, but Cantillo hasn't added any fastball velocity (he sat 87-89 in the Fall), so I can't justify moving him into the Top 100 this offseason. I still think, even at a lesser velocity, Cantillo's fastball will play fine because of its flat angle and the big carry created by how perfectly it backspins, but it needs to become at least a low-90s offering to have a shot to dominate (like Colin Poche's fastball). It behooves Cantillo to add power to his breaking ball as well. Though it only needs to function as a pitch he can flip into the zone for a strike once in a while, it's currently bending in at about 70 mph and that gives hitters too much time to adjust to it in mid-air. But Cantillo's money pitch is his changeup, and his ability to locate it in consistently enticing areas. He's still just 21 and his new org has a history of helping pitchers add velo, and for getting the most out of changeup/command pitchers, but until we see a velocity spike I'll have Cantillo in the 45 FV tier. <em>(Alternate site)</em>",,"sa3005246"
"Emmanuel Clase","CLE","SIRP","MLB",,18,,"40+",2021,"High","23.2138888","6' 2""","206","R","R",2014,"J2","SDP",125000,"Dominican Republic","Due to both a severe late strain and a positive PED test, Clase (pronounced CLAH-say) didn't pitch at the alt site (the suspension prevented it) and instead threw a little during instructs (he sat 97-98) and then tossed a single inning for Estrellas Orientales in LIDOM. He was throwing hard but looked out of shape. Rather than move him back into the 45 FV tier now that the (modified) duration of his suspension has concluded, I'm leaving him in the 40+ tier due to skepticism about his ability to be as explosive as one needs to in order to throw 99-102 without help. That kind of arm strength made Clase internet baseball famous for a minute during his tongue-burning, 23-inning big league cup of coffee in 2019. His cutting fastball sat around 99 mph and touched 102.7 during that stretch. He looked like a huge steal for Texas, which pilfered him from San Diego, straight up, for Brett Nicholas. When Clase was announced as the PTBNL for Nicholas in May of '18, he hadn't yet pitched that year. By that Fall he was sitting in the upper-90s with natural cut. His 40-man timeline and relative inexperience were likely part of why San Diego was willing to move him. Cleveland acquired him from Texas as part of the Corey Kluber trade the following offseason. He still hasn't thrown a pitch for a Cleveland affiliate. <em>(Fall Instructional League, LIDOM)</em>","SvtUnSGGEK4","21032"
"Carson Tucker","CLE","SS",,,19,,"40+",2025,"High","19.3638888","6' 1""","175","R","R",2020,"Draft","CLE",2000000,"Mountain Pointe HS (AZ)","It was fascinating to hear scouts who see pro players, specifically the very talented group of teenage shortstops in this system, describe Tucker after I had watched him among domestic high schoolers and discussed him with amateur scouts. After Tucker looked explosive but unpolished to my eye on the showcase circuit, then seemed to take a real leap during an abbreviated senior season, multiple scouts who saw him in Goodyear now consider him a high-floor, lower-ceiling player. It's possible Tucker looks much different in the pro context, or that, like many of us, he was just weary from dealing with months of our earthly reality. I'm inclined to bet on what I saw with my own two eyes when Tucker was an amateur and continue to have him placed as a high-variance, high-ceiling talent. <em>(Fall Instructional League)</em>","YV4npHUgpkg","sa3014470"
"Tanner Burns","CLE","SP","A+",,20,,"40+",2024,"Med","22.4361111","6' 0""","215","R","R",2020,"Draft","CLE",1600000,"Auburn","I'm a little lighter on Burns than the industry consensus, which tends to have him as a low variance 45 FV arm. I don't think statistical success for SEC pitching necessarily translates to pro ball (see: Pilkington, Konnor) and Burns is a squat guy with a high-effort delivery whose stuff is just okay. He was up to 97 before his junior year but I have him sitting 90-92 and touching 95 during the college season, then throwing about that hard in a single-inning Fall outing with Cleveland. Burns does have a tight slider in the 78-81 mph range; his curveball velocity band overlaps with the slider a bit but it has distinct shape. He also throws a mid-80s changeup with sink, but worked very, very heavily off the fastball in college. I'd like to see his secondary usage increase in pro ball. Burns also has advanced pitchability elements, and he'll vary his delivery home to mess with hitters' timing. He profiles as a four-pitch rotation piece who'll outpace my projection if he can either a) show he can execute all his secondary pitches consistently or b) add velocity. I think the former is more likely. <em>(Fall Instructional League)</em>","xMsuCeUZ6NE","sa3014451"
"Logan Allen","CLE","SP","A+",,21,,"40+",2024,"Low","22.75","6' 0""","180","R","L",2020,"Draft","CLE",1125000,"Florida International","This is 2020 draftee Logan Allen. The other Logan Allen lost rookie eligibility in 2020; his report can be found on the Graduates tab of The Board. This Allen's playerid number is sa3014444 and his birthday is September 5, 1998, for those of you who want to avoid guessing which one to click on when you search for him on the site. Allen was an undersized, pitchability high school lefty who worked 88-92, with mostly average secondary stuff and a changeup that flashed plus. He was a third or fourth rounder at that point, then posted fantastic numbers at FIU, on the Cape, and for Team USA, enabling Allen to move into the second round come draft time. Though his fastball only sits 88-91 at times, Allen is a great athlete (he played both ways in college) with a well-balanced, repeatable delivery and plus command projection, and he hides the ball well, which should enable him to work at that velocity without getting shelled. Cleveland has done wonders with many strike-throwing college pitchers with good command, and Allen has a shot to blow up if he starts throwing harder while focusing solely on pitching. <em>(Fall Instructional League)</em>","5zHaWS5uk7o","sa3014444"
"Petey Halpin","CLE","CF",,,22,,"40+",2025,"Med","19.025","6' 0""","180","L","R",2020,"Draft","CLE",1525000,"St. Francis HS (CA)","Halpin's profile seems to be right in the crosshairs of Cleveland's draft model. He was a SoCal high schooler a tier below the glitzy Pete Crow-Armstrong group (Halpin was pushed to center field on the NorCal Area Codes team by the SoCal outfield depth), was young for the draft class, and has an impressive feel for contact, all of which seem to be drivers for the Cuyahoga contingent's draft preferences. Though he's wiry and skinny-looking, Halpin has sneaky pop because of how consistently he gets the bat head on the baseball. His amateur swing had a very upright front side through finish, and yet he was still able to drop the bat head and impact pitches toward the bottom of the strike zone, and in general he has great top-to-bottom coverage of the zone. He seemed to be working with a more open stance in the Fall and he had clearly added muscle during the 2020 layoff. That may alter the nature of his contact quality, but for now I have Halpin projected as a leadoff-hitting center fielder. <em>(Fall Instructional League)</em>","wIEKvoOJ1No","sa3014461"
"Junior Sanquintin","CLE","SS","R",,23,,"40+",2023,"High","19.4083333","6' 0""","180","S","R",2018,"J2","CLE",1250000,"Dominican Republic","Cleveland's young infield contingent has begun to spread throughout these rankings as their bodies mature and more light is shed on their likely defensive futures, and their showcase skills and hitting acumen are actually tested during in-game competition. Of all the teenage infielders, it's Sanquintin's profile that remains the cloudiest. There's no scout consensus as to which infield spot he fits best, and both his left- and right-handed swings need to cleaned up to work but are really exciting because of his bat speed. He swings hard and shows power potential from both sides, but his hands are awfully noisy from the left, while his righty bat path sometimes chops downward in an ineffectual way. 
But Sanquintin shows a crude knack for putting the bat on the ball and hitting it hard, and switch-hitters typically take a little longer to refine their swings. Sanquintin isn't in the Ronny Mauricio mold where you can pretty easily see him adding 20 pounds while staying at shortstop. He's a little more compact than that at a square-shouldered 6-foot-1, a little thicker and more physical than the typical 19 year old. He could end up at third base or as a big, strong, heavy-footed second baseman, or the cement might be dry on his frame and he stays at short. Either way, the important thing is that Sanquintin continue to refine his feel to hit from both sides of the plate, as switch-hitting infielders with power can basically play anywhere. <em>(Fall Instructional League)</em>","I0cN4L2seo0","sa3010863"
"Nick Mikolajchak","CLE","SIRP","AA",,24,,"40+",2023,"Med","23.5388888","6' 2""","215","R","R",2019,"Draft","CLE",125000,"Sam Houston State","Mikolajchak bounced back and forth between the Sam Houston bullpen and rotation during his final two years there, looking best in relief and projecting there in a big league role. He was 90-95 with an above-average curveball after signing in 2019. Then Mikolajchak arrived for instructs in the Fall of 2020. I've spoken with scouts who bookended his Fall work and it sounds like he was 90-92 in his first outing, then wrapped up instructs sitting 95-97, which he was blowing past everyone. The two pitchers sounded so different that I had to make sure neither of the scouts I spoke to had the wrong player. There's also evidence of a leap in Mikolajchak's pitch data: more spin, more induced vertical movement on his fastball and a harder curveball. He now has an impact power pitcher's fastball/curveball combo. After he threw four different pitches in college, he projects to work with three (his changeup looks good on paper but the scouts I spoke with didn't see it in the Fall) out of a big league bullpen, and based on how vigorously the arrow is pointing up for him after his Fall in Arizona, he may move very quickly. <em>(Fall Instructional League)</em>",,"sa3010303"
"Josh Wolf","CLE","SIRP","A",,25,,"40+",2024,"High","20.7611111","6' 2""","175","R","R",2019,"Draft","NYM",2150000,"St. Thomas HS (TX)","Wolf was a 2019 high school draftee from Texas who had a velo bump between his showcase summer and senior spring, when he was suddenly 94-97 with a plus breaking ball at times. He does not have your typical starter's build even though his on-paper measurables are pretty standard for a starter. He's very narrow and spindly rather than strapping and broad. Plus, Wolf's arm action is much longer than a starting pitcher's typically is, but that's something that Cleveland has been good at altering. That might aid Wolf's changeup growth. He has nascent feel for locating the change, but not for creating action on it. I think a path to starting more likely means a developmental course that ends with Wolf having two distinct breaking balls. Based on his frame composition, atypical delivery, and style of pitching, I have Wolf projected in relief, but he has high-leverage stuff. <em>(Fall Instructional League)</em>",,"sa3011638"
"Cody Morris","CLE","MIRP","AA",,26,,"40+",2022,"Med","24.5861111","6' 5""","225","R","R",2018,"Draft","CLE",185600,"South Carolina","Morris was a power-armed prep righty from Maryland who was ushered toward college by a Tommy John, which he rehabbed during a redshirt first year at South Carolina. He performed well both seasons in Columbia, his inning total doubling from 2017 to 2018. Cleveland shut him down after the 2018 draft, then asked him to make 20 starts (at a little over four innings per start) in 2019. Morris' innings count is important because he was throwing really hard, especially early in the year, before wavering late. During 2020 instructs he was parked in the mid-90s and up to at least 98, but again this was in a developmental setting. If he can hold that velo for a 120 innings, he's a No. 4/5 starter, but until he proves it, I have Morris projected in a three-pitch middle relief role. <em>(Fall Instructional League)</em>",,"sa3008653"
"Gabriel Rodriguez","CLE","3B","A",,27,,"40+",2023,"High","19.2861111","6' 2""","195","R","R",2018,"J2","CLE",2100000,"Venezuela","Rodriguez got very muscular very quickly and he was much more physical than almost the entire rest of the DSL, which is part of why Cleveland promoted him to the States for the final few weeks of the 2019 AZL season. There Rodriguez's swing-happy approach was exposed and he struck out in about a third of his at-bats. With his added size and a new, early evaluation of his plate discipline, there's a growing chance that Rodriguez is a low-OBP corner prospect, which is a difficult box to mash your way out of. But for now, he also has a non-zero chance to stay at short and hit for a ton of power. His bat speed and physicality are both impressive for a such a young player. There's big ceiling here, but also extreme risk. <em>(Fall Instructional League)</em>","JQBYAlGbKIw","sa3008744"
"Isaiah Greene","CLE","CF",,,28,,"40",2025,"High","19.7666666","6' 1""","180","L","L",2020,"Draft","NYM",850000,"Corona HS (CA)","Greene was a 2020 draftee out of a SoCal high school, and he's a frame-based projection prospect who may have had a bigger breakout senior year had the pandemic not squashed his pre-draft season. Teams and scouts who liked him best as an amateur thought he had pretty good feel for contact and were projecting on both his broad-shouldered, He's an average athlete who struggled to get over his front side on throws from the outfield during my looks at him in 2019. That's one of a few developmental things to watch as Greene traverses the minors. The big one, though, is his swing. As an amateur (again, going off my 2019 summer looks here) his swing was really long and needed pretty significant polish to be playable, but he wasn't loading his hands quite as deep during his first pro instructs, and he had a better Fall than expected. It's likely that Cleveland's amateur report drove their desire to acquire Greene since he was a recent draftee who only saw instructs action. And in this regard Greene isn't your typical Cleveland prospect in that he was a little older than the typical high school prospect and is already 19 and a half. However, since you're reading this list, you know they have a penchant for SoCal hitters. Some scouts do not agree with me about the swing. They like Greene's cut and had him in the late-first, early-second round mix. I had him in the third round as a higher variance sort, with the speed for center field (for now), considerable body projection (which might impact the range in center), and the need for a swing overhaul. <em>(Fall Instructional League)</em>",,"sa3014460"
"Hunter Gaddis","CLE","MIRP","A+",,29,,"40",2023,"Med","23.1555555","6' 6""","212","R","R",2019,"Draft","CLE",415000,"Georgia State","Gaddis' changeup grip and release is similar to Devin Williams', and the pitch sometimes has more than 15 mph of velocity separation from his fastball, which now resides in the mid-90s at peak, but was down in the low-90s in 2020. The changeup is his best pitch, and disappears beneath the bats of right-handed hitters when he releases it right. Gaddis can also create bat-missing depth on his slider, though it isn't quite as consistent. He has a viable starter's three-pitch mix, but the relative stiffness in his delivery, which includes a pretty violent head whack, pushes him toward a multi-inning relief role for me. <em>(Fall Instructional League)</em>","KFq1VCfszA4","sa3010621"
"Bryan Lavastida","CLE","C","A+",,30,,"40",2022,"Med","22.5222222","6' 0""","200","R","R",2018,"Draft","CLE",175000,"Hillsborough Community College (FL)","Lavastida continued to improve defensively and show ongoing signs of offensive competence during 2020 instructs, so with his 40-man deadline arriving in 2021, he's no longer just an interesting developmental sleeper. He's now a high-priority follow for teams (and for internal evaluation) throughout next season. 
Though he squatted a few times at JUCO in the month leading up to the 2018 draft, Lavastida only totally moved from shortstop to catcher after he entered pro ball. His hitting hands are pretty powerful, working in a lift-friendly circle (Lavastida inside-outs some balls he could pull but he's strong enough to do damage anyway), and Lavastida has had no issues adjusting to pro pitching while learning to catch. He struck out just 12% of the time against Penn League pitching in 2019. His defense may be challenged when he's forced to catch real big league stuff with greater regularity, and because he was alternating between catching and DH during most of 2019 we don't know whether Lavastida's offense will be diluted by catcher's bumps and bruises. But because he has a shot to both catch and be a viable offensive threat, Lavastida is a 2021 breakout candidate. <em>(Fall Instructional League)</em>",,"sa3006917"
"Richard Palacios","CLE","2B","AA",,31,,"40",2022,"High","24.0527777","5' 9""","160","L","R",2018,"Draft","CLE",475000,"Towson","Palacios will be 24 years old by the time he finally gets at-bats at a full-season affiliate since he missed all of 2019 recovering from labrum surgery. He took advantage of his rehab and looked absolutely jacked during instructs, his first action in nearly two years. 
Had he not gotten hurt and were it not for the pandemic, Palacios might have reached the majors already. He was a polished college hitter who walked 52 times and struck out just 16 as a junior at Towson while also swiping an ultra-efficient 25 bases in 26 attempts, and he hit .360/.420/.538 against low-level pro pitching after he signed. He's a nearly plus-plus runner and a capable middle infield defender (probably at second, based on how his arm stroke works) with premium hand-eye coordination and bat control. He's a line drive spray hitter without big game power, despite his impressive physique. There was some concern that Palacios beat up on small conference pitching his entire career, and that he may not replicate that performance against pro pitching, a concern he hasn't yet had the opportunity to allay. He was one of the older prospects at instructs but also hadn't seen in-game pitching for quite some time, making him a very difficult contextual evaluation. It's rare for contact-oriented hitters to be high variance prospects, but the layoff and injuries push Palacios into that bucket. <em>(Fall Instructional League)</em>",,"sa3006908"
"Jose Tena","CLE","SS","A+",,32,,"40",2024,"Med","20.2083333","5' 9""","160","L","R",2017,"J2","CLE",400000,"Dominican Republic","I had a hard time sourcing new opinions on Tena, who seemed lost in the shuffle of Cleveland's huge shortstop contingent at instructs. His report is the same except to note that he is one of several prospects in this system who looks like they spent a lot of time working out during quarantine, and Tena's center of gravity looks higher now than when he was in the 2019 AZL. He'd be in the 40+ FV tier were he not so aggressive at the plate, but early indicators are that he suffers from Vitters' Affliction, swinging so often because, for now, his excellent feel for contact is enabling an approach that's less likely to be tenable at the upper levels. That feel for contact comes despite a sometimes noisy, wild swing that has Tena's wheels spinning as he's trying to run out of the batter's box. That he has such strong, top-to-bottom plate coverage, even when he's swinging out of his ass, makes him exciting from a contact/power potential combo standpoint. Might as well turn him loose and let him swing like that since it doesn't seem to impact his quality of contact as much as <em>what</em> he decides to swing at does. The skillset and build evoke Rougie Odor. <em>(Fall Instructional League)</em>","NGKt-rzv9sc","sa3005482"
"Nick Sandlin","CLE","SIRP","MLB",,33,"&uarr;","40",2021,"Med","24.4027777","5' 11""","170","R","R",2018,"Draft","CLE",750000,"Southern Mississippi","The submarinering Sandlin had a ridiculous junior year at Southern Miss (144 strike outs and just 18 walks in 102 innings), his first as a starter since arriving at campus. He was thought to be one of the fastest-moving pitchers picked in the 2018 draft, and indeed Cleveland pushed him quickly through the system, assigning him to the Double-A bullpen to begin 2019, his first full pro season. He was quite good there, then moved to Triple-A for two weeks before he was shut down due to a forearm stress fracture that required surgery (he dealt with forearm issues earlier in the year, as well). He was back for the 2020 alternate site and instructs, and at the latter was back to sitting his customary 90-93, albeit with worse control than he had during his prospect peak. Sandlin's slider has cuttery, lateral actions rather than meaningful vertical movement on its own or as it relates to his fastball. He may need to find another secondary pitch to garner swings and misses. Sandlin's velocity resurged in 2021 and he looks more like a stable middle-inning piece now than an up/down reliever. <em>(Alternate site, Fall Instructional League)</em>","ZrCL8mY_wUU","20517"
"Trevor Stephan","CLE","SIRP","MLB",,34,,"40",2021,"Med","25.5277777","6' 4""","210","R","R",2017,"Draft","NYY",797500,"Arkansas","Cleveland's Rule 5 pick, Stephan, was at New York's alt site all year. His cross-bodied delivery compares closely to that of Brewers righty Freddy Peralta, as both get way down the mound (Stephan gets nearly seven feet of extension on his fastballs) and have lower arm slots that make right-handed hitters very uncomfortable. He makes heavy use of a hard slider that at times looks like a cutter. It has enough movement to miss bats even if Stephan leaves it in the zone, and he's been able to back foot it to lefties. He may add a curveball and try to work multiple innings down the line, but for now I have him in as a single-inning middle relief piece. <em>(Alternate site)</em>","hdrgIwlwXuE","19932"
"Jose Fermin","CLE","SS","AA",,35,,"40",2023,"Low","22.1833333","5' 11""","160","R","R",2015,"J2","CLE",500000,"Dominican Republic","No change to Fermin's blurb, as he's the same guy. He had the eighth-lowest swinging strike rate in the minors in 2019, a measly 4%. He has a minimalistic cut and excellent hand-eye coordination, which have enabled him to run about an 8.5% strikeout rate the last two seasons. He's also a capable defensive shortstop. Players like this often outperform eyeball-only evaluations and, heuristically, a hitter like this with almost elite bat-to-ball skills who also plays a premium position typically ends up in a higher FV tier than this. But in Fermin's case, I think he lacks the power on contact to be an everyday player. I realize those can be famous last words when it comes to a profile like this one, but in this case I think the power is limiting and I have a low-variance bench infield grade on him. <em>(Fall Instructional League)</em>",,"sa917339"
"Milan Tolentino","CLE","SS",,,36,,"40",2025,"Med","19.55","6' 1""","180","L","R",2020,"Draft","CLE",800000,"Santa Margarita Catholic HS (CA)","As is the case with Petey Halpin, Tyler Freeman, and Joe Naranjo (in the honorable mentions), Tolentino was a SoCal high schooler with advanced feel for contact. Of that list, he's the best defender by a long shot. In fact, he was one of the slicker infield defenders in the 2020 draft, regardless of demographic. I think Tolentino is much like Fermin, just a few years behind him, likely to be an infield utility man. <em>(Fall Instructional League)</em>",,"sa3014544"
