"Raymond Burgos","CLE","MIRP","A+",,37,,"40",2021,"Med","22.5166666","6' 5""","170","L","L",2016,"Draft","CLE",,"Pedro Falu Orellano HS","Burgos was a Day Three prep projection pick in 2016, and spent the first year and a half of his career rehabbing from Tommy John. Since returning, he has thrown a surprising number of strikes for a tightly-wound 6-foot-5 guy, and his velocity has been climbing for the last few years. He has a good changeup, a curveball he can locate consistently and that really plays against lefties because of Burgos' length, as well as a distant fourth-pitch cutter/slider. Burgos had been among the Honorable Mentions on several past lists, pushed down due to either a lack of velocity or injury (he missed summer of 2016, all of '17, and the back half of '19). Since high school, he has gone from touching the upper-80s, to sitting 91-94 in 2018 and '19 before he got hurt, to sitting 93-96 with tail and sink during parts of the Fall of '20, but 90-92 at other times. Burgos was Rule 5 eligible this year, but was not selected as there were pitchers with comparable stuff but less volatility. I think a multi-inning relief role will balances Burgos' repertoire depth with what seems like a lack of durability, and a short runway to build innings before next year's 40-man deadline. <em>(Fall Instructional League)</em>",,"sa918469"
"Bobby Bradley","CLE","DH","MLB",,38,,"40",2021,"Low","25.0166666","6' 1""","225","L","R",2014,"Draft","CLE",912500,"Harrion Central HS (MS)","Bradley was at the alt site all year, so his report stays the same. He's a three true outcomes DH prospect who I think will have a front-loaded career in terms of production based on his build and athleticism. There's a non-zero chance the strikeouts cause the power production to bottom out against big league pitching, in which case Bradley could take the Roberto Ramos route to Asia. He'll compete with Josh Naylor, Franmil Reyes and the other Cleveland DH types next spring. <em>(Alternate site)</em>","JeDVcWGcXVk","17278"
"Alexfri Planez","CLE","RF","A",,39,,"40",2024,"High","19.8","6' 2""","180","R","R",2017,"J2","CLE",400000,"Venezuela","Planez did not come stateside for instructs due to travel difficulty coming from Venezuela, so his blurb remains the same as last year's. He has big time pull-side lift in his swing, already has average raw power at age 18, and has a fairly projectable 6-foot-2 frame that portends more. He'll reach down and barrel balls near his shoe tops and also crush center-cut mistakes. He's too aggressive right now, his swing is somewhat grooved, and he probably has to move to a corner eventually, so my early assessment of the profile is that it's very risky, enough that I think Planez needs to be a clear tier behind the Sanquintin/Rodriguez/Martinez group. But as far as teenage power projection bats go, this is a pretty good one. <em>(At-home dev)</em>",,"sa3005515"
"Angel Genao","CLE","SS",,,40,,"40",2021,"Med","17.0444444","5' 11""","150","R","R",2021,"J2","CLE",1175000,"Dominican Republic","Cleveland seems to prioritize switch-hitting, up-the-middle players in the international market and they have yet another in Genao, who has become much more physical in the months leading up to signing. His swing is crude from both sides but he's a good athlete with a good frame.",,
"Yordys Valdes","CLE","SS","A",,41,,"35+",2024,"High","19.8027777","5' 10""","170","S","R",2019,"Draft","CLE",1000000,"McArthur HS (FL)","An acrobatic shortstop, Valdes was among the better infield defenders available in the 2019 draft. He was also one of its youngest prospects, and has shown above-average bat speed from both sides of the plate. He has underdeveloped feel to hit, but that's typical of switch-hitters this young. Valdes is a well-built 5-foot-10 and so young that he's very likely to get stronger as he matures. He has everyday tools, but needs significant offensive development and I think it's more likely he ends up as a glove-first utility man. <em>(Fall Instructional League)</em>",,"sa3010037"
"Cam Hill","CLE","SIRP","MLB",,42,,"35+",2021,"Low","27.0305555","6' 1""","185","R","R",2014,"Draft","CLE",75000,"Redlands CC (OK)","Hill threw more strikes than expected during his 2020 debut, which allowed him to succeed despite a downtick in velocity. His heater has natural cut at times and both of his breaking balls are consistently average and flash plus, the slider doing so more often than the curve. He's an up/down reliever if he's still parked in the low-90s, but might grab hold of a consistent bullpen spot if his velo bounces back into the mid-90s, which is where it was in 2019 (93-96). <em>(Alternate site)</em>",,"16840"
"Eli Morgan","CLE","MIRP","AAA",,43,,"35+",2021,"Med","25.0611111","5' 10""","190","R","R",2017,"Draft","CLE",135000,"Gonzaga","Sequestered at the alt site, Morgan's blurb remain's the same, though I'll note here that his velocity once again held in the upper-80s in 2020. His velocity bounced back from 2018's career low and now, back in the 88-90 range and aided by some deception, his fastball is a viable big league offering. The impact pitch is Morgan's changeup, which has disorienting angle and fade. I think he'll live off of his strike-throwing (he has good breaking ball utility even though it's not a nasty pitch) and changeup enough to be a fifth starter. <em>(Alternate site)</em>",,"20203"
"Xzavion Curry","CLE","SP","A+",,44,,"35+",2023,"Med","22.8555555","5' 11""","190","R","R",2019,"Draft","CLE",,"Georgia Tech","A 22-year-old coming out of a major program (Georgia Tech) who was given a conservative assignment to Low-A and is facing hitters who are less experienced than the ones he competed with in the ACC. But Curry’s performance has been dazzling and he had a 38-to-4 strikeout-to-walk ratio across five starts. Drafted in 2019, Curry’s first affiliated games came in 2021 because he dealt with shoulder inflammation in his draft year. He appears to be getting down the mound a little but better now than while at Tech, but otherwise he appears unchanged. His vertical arm slot creates angle and carry on a fastball that plays well at the letters even though it’s in the low-90s (Curry was 89-92 in college, has been more 91-94 this year), and his arm slot helps create vertical action on both of Curry’s breaking balls. He has a backend/spot start vibe right now.",,"sa3014790"
"Robert Broom","CLE","SIRP","AAA",,43,,"35+",2021,"Low","24.7166666","6' 1""","190","R","R",2018,"Draft","CLE",,"Mercer","Those of you who are fans of nominative determinism, especially if you were disappointed by J.D. Hammer's lack of breaking ball, will be glad to know that Robert Broom has a sweeping slider. Like most low-slot relievers, he has a tailing fastball and slider combination that relies on deception and location to succeed. So far, Broom's has. He owns a career 0.90 ERA in 90 innings up through Double-A and he projects as a ""look"" reliever. <em>(Fall Instructional League)</em>","bGpgh0siZiU","sa3007235"
"Scott Moss","CLE","MIRP","AAA",,45,,"35+",2021,"Med","26.6638888","6' 6""","225","L","L",2016,"Draft","CIN",577400,"Florida","Sourcing Moss' pitch data from the alternate site indicated he may have been going through a change to the way he throws his fastball (maybe a new grip or seam orientation), as his velocity band for that pitch is larger than usual. He may end up looking at little different next year, but he had been a low leverage long relief prospect because of his repertoire depth, unable to start due to a lack of athleticism and command. <em>(Alternate site)</em>",,"sa738902"
"Jean Carlos Mejia","CLE","SP","MLB",,46,,"35+",2021,"Med","24.775","6' 4""","240","R","R",2013,"J2","CLE",45000,"Dominican Republic","Mejia was injured for all but 33 innings of 2019, his first on the 40-man roster, then pitched at the alternate site in 2020. His velocity and stuff were the same there as they were on last year's list. I like him as a sinkerballing spot starter. <em>(Alternate site)</em>",,"20617"
"Jhonkensy Noel","CLE","1B","A",,47,,"35+",2022,"High","19.8888888","6' 1""","190","R","R",2017,"J2","CLE",100000,"Dominican Republic","Noel has played some third base, but he's only a realistic athletic fit at first. Because he's of the right/right variety, he'll need to hit and hit for power with annual statistical evidence of his proficiency to continue to stay on the prospect radar. Ordinarily I'll have players like this, who are still far from the majors, in the Honorable Mention section of the list, but in Noel's case the top end of his exit velocities are pretty ridiculous for his age. <em>(Fall Instructional League)</em>",,"sa3005579"
"Adam Scott","CLE","SIRP","AA",,48,,"35+",2022,"Low","25.6527777","6' 4""","220","L","L",2018,"Draft","CLE",50000,"Wofford","Scott was neither at the alt site nor instructs, so his report is the same. He was a 2018 fourth round senior sign, then spent most of his first pro season all the way up at Double-A. He was in the 88-92 range that year but his stuff ticked up in 2019, sitting 90-94 and touching 95 with the fastball, while locating his wipeout slider to his glove side. He's tracking like a quick-moving reliever, at least. <em>(At-home dev)</em>",,"sa3006826"
"Steven Kwan","CLE","CF","AA",,49,,"35+",2022,"Med","23.75","5' 9""","175","L","L",2018,"Draft","CLE",185000,"Oregon State","There's no change to this report. Kwan was one of the older players invited to instructs. He had the third-lowest swinging strike rate among qualified minor league hitters in 2019. He's not especially toolsy (other than the contact skills) and relies entirely on instincts in center field, where he's actually pretty good. He doesn't have the power to play every day, but he might find a niche bench role. <em>(Fall Instructional League)</em>",,"sa3008536"