"Tyler Keenan","SEA","1B",,,25,,"40",2024,,"21.3805555","6' 3""","240","L","R",2020,"Draft","SEA",,"Ole Miss","Keenan has all-fields power and performed all three years at Ole Miss. He played third base in college but is listed at 240 and is likely to be limited to 1B/DH in pro ball.",,
"Carter Bins","SEA","C","A-",,26,,"40",2023,,"22.175","6' 0""","200","R","R",2019,"Draft","SEA",350000,"Fresno State","Bins has plus bat speed and a great build for a catcher. His swing is grooved and he needs defensive polish, but he at least has power/arm carrying tools and a good chance to be a whiff-prone backup.",,"sa1115884"
"Kaden Polcovich","SEA","2B",,,27,,"40",2024,,"21.3972222","5' 10""","195","S","R",2020,"Draft","SEA",,"Oklahoma State","Polcovich is a switch-hitter with some power, and junior college performer preceding a good Cape and early-2020 with freshly minted Oklahoma State threads. He's a plus runner with below average hands who is not a lock to stay at second base and may have to give center field a try. ",,
"Ljay Newsome","SEA","RHP",,,28,,"40",2021,,"23.6833333","5' 11""","210","R","R",2015,"Draft","SEA",,"Chopticon HS (MD)","Like Gerber, Newsome has a short, weird arm action that seems to bug hitters and create abnormally strong results on a fastball that is, in most respects, barely average. He does have a plus changeup and throws an obnoxious rate of strikes. To this point, Newsome's smoke and mirrors have worked as a starter up through Hi-A. The velo bump he worked for two offseasons ago has made a difference, and he projects as a swingman type now.",,"sa875837"
"Josias De Los Santos","SEA","RHP","A",,29,,"40",2022,,"20.9583333","6' 2""","175","R","R",2017,"J2","SEA",,"Dominican Republic","The Mariners pushed De Los Santos to full-season ball last year because his secondary stuff desparately needed reps and they trusted him to scrap through starts early on even though it wasn't ready. He succeeded and now looks like a fastball/cutter/slider relief prospect.",,"sa3006508"
"Devin Sweet","SEA","RHP","A+",,30,,"35+",2022,,"23.8555555","5' 11""","185","R","R",2018,"Draft","SEA",,"North Carolina Central","Sweet was a 2018 undrafted free agent senior sign who had a 2019 breakout. He began the year in the Low-A bullpen (50 K, 9 BB in 35 innings), then in June was moved to the rotation and thrived for 12 starts. He made a few late-August starts at Hi-A, and was good there, too. Sweet has fastball command, fastball ride, and a plus changeup. He's a little light on velocity, only sitting 90-93, but he's garnered swings and misses at that velocity at the top of the strike zone so far. His changeup has bat-eluding sink and fade, and is used against righty hitters. The breaking ball is just okay, but he can land it for strikes to start counts. 
It's a 40-man look, to be sure. Perhaps the velo would tick up in the bullpen in an interesting way (all our Sweet info comes from folks who've seen him start), but for now he projects in the fifth or sixth starter area.",,"sa3008340"
"Yohan Ramirez","SEA","RHP","AA",,31,,"35+",2020,,"25.1888888","6' 4""","190","R","R",2016,"J2","HOU",,"Dominican Republic","Ramirez’s career got off to a late start (he didn’t begin playing pro ball until he was 21) and he was also a little slow to develop, languishing in A-ball for several years. His stuff really started to pop in 2018, and last season he showed bat-missing, multi-inning stuff — 92-97, up to 99, two plus breaking balls. He walked 74 hitters in just over 100 innings last year, which needs to be better if he’s going to stick.",,"sa922200"
"Jorge Benitez","SEA","LHP","A",,32,,"35+",2022,,"21.1194444","6' 2""","155","L","L",2017,"Draft","SEA",150000,"Leadership Christian HS (PR)","Rejoice! Those who saw Benitez as an amateur and hoped he'd enjoy a pro velo bump have been proven correct, as the 20-year-old lefty was sitting 89-92 and up to 94 last year. He has big curveball spin rates but the pitch is pretty easy to identify out of his hand, and he barely throws it. It'll be interesting to see if the dev group tries to make the curveball more playable or if they explore other out-getting avenues now that viable velo appears to be on the way.",,"sa3004462"
"Damon Casetta-Stubbs","SEA","RHP","A",,33,,"35+",2023,,"20.9777777","6' 4""","225","R","R",2018,"Draft","SEA",325000,"Kings Way HS (WA)","The fastball/frame projection here is just okay, but Casetta-Stubbs has two excellent breaking balls and an advanced understanding of how to deploy them together to thwart hitters, similar to how Drew Pomeranz attacks guys. He's a black sheep relief prospect.",,"sa3008387"
"Aaron Fletcher","SEA","LHP",,,34,,"35+",2022,,"24.3861111","6' 0""","220","L","L",2018,"Draft","WSN",125000,"Houston","Fletcher's big hip turn helps him hide the ball pretty well, his slider has sufficient sweep despite low spin rates, and his changeup and two-seamer pair well together. He'd be a 40 FV relief prospect if his command were a shade better.","S7p6GO2eEEU","sa3007591"
"Raymond Kerr","SEA","LHP","AA",,35,,"35+",2021,,"25.8444444","6' 3""","185","L","L",2017,"UDFA","SEA",,"Lassen CC (CA)","Kerr can dunk a basketball, he has superlative weight room exploits, and he has rare lefty velo. His splitter flashes plus and the Mariners have worked with his slider enough to create viable sweep on the pitch. The strike-throwing and secondary consistency are present issues, but Kerr has come so far, so fast (he was sitting in the low-90s early last spring) that it's fair to project on that stuff, even though he's in his mid-20s.","IzFQquSaOzA","sa3005362"
"Milkar Perez","SEA","3B","R",,36,,"35+",2023,,"18.7444444","5' 11""","173","R","R",2018,"J2","SEA",175000,"Nicaragua","Perez has more of a frame than his measurables suggest, he has advanced feel for the strike zone and for contact, and he might grow into enough power to profile as a well-rounded everyday third baseman. But the frame isn't so overtly projectable as to make it a likelihood.",,"sa3008883"
"Kristian Cardozo","SEA","RHP",,,37,,"35+",2025,,"17.6777777","6' 1""","175","R","R",2019,"J2","SEA",595000,"Venezuela","Cardozo signed for just shy of $600,000 last July. He doesn't have the typical July 2 prospect's physical projection, but his delivery is loose and repeatable. He's been up to 92 with feel for his breaking ball and change.",,
"Luis Liberato","SEA","CF","AA",,38,,"35+",2020,,"24.5722222","6' 1""","175","L","L",2013,"J2","SEA",140000,"Dominican Republic","He's 24 but I still think Liberato's physical tools and relatively solid track record of performance merit inclusion in this FV tier. He runs well, has a great frame, and made substantive improvements to his contact rates with a 2018 swing change. I think there's still a chance he contributes in some way.",,"sa737020"
"Austin Shenton","SEA","3B",,,39,,"35+",2022,,"22.4777777","6' 0""","205","L","R",2019,"Draft","SEA",336000,"Florida International","Shenton had a loud Cape, then regressed athletically the following spring and looked more like a future first baseman. He has pop, but needs to hit a ton to profile at either corner spot.",,"sa3009869"
"Sam Carlson","SEA","RHP","A",,40,,"35+",2022,,"21.6138888","6' 4""","195","R","R",2017,"Draft","SEA",2000000,"Burnsville HS (MN)","We're still collectively waiting for Carlson to pitch coming off of Tommy John. At his prep peak, he was into the mid-90s with a good changeup and more strikes than is typical for such a hard-throwing, cold-weather prospect.","PK5O-3F8YyM","sa3005015"
"Levi Stoudt","SEA","RHP",,,41,,"35+",2023,,"22.6111111","6' 1""","175","L","R",2019,"Draft","SEA",339000,"Lehigh","Stoudt is a relief prospect with a plus changeup who went lower in the 2019 draft than his talent suggested because the industry knew he needed TJ after signing.",,
"Ty Adcock","SEA","RHP",,,42,,"35+",2022,,"23.4361111","6' 0""","213","R","R",2019,"Draft","SEA",150000,"Elon","Adcock is a catcher conversion arm who emerged a year after he was first draft-eligible. He's an upper-90s power relief prospect who didn't throw after the draft.",,
"Jake Haberer","SEA","RHP","AA",,43,,"35+",2020,,"25.4305555","6' 2""","225","R","R",2018,"Draft","SEA",,"Eastern Illinois","An undrafted free agent who was signed out of Indy ball with the notion that he'd eventually be an in-office contributor, Haberer cruised through A-Ball and now is in the upper levels at age 24 and throwing very hard. He was up to 99 last year and has a shot to be a bullpen contributor.",,"sa3008514"