"Victor Santos","PHI","RHP","A",,37,,"35+",2023,,"20.0055555","6' 1""","191","R","R",2016,"J2","PHI",,"Dominican Republic","A pitchability teenager with a good changeup, Santos slings in average stuff, some of which plays up because of his funky, long arm action. His realistic ceiling is that of a fifth or sixth starter.",,"sa3003083"
"Carlos De La Cruz","PHI","RF","A",,38,,"35+",2023,,"20.7722222","6' 8""","210","R","R",2017,"J2","PHI",,"Dominican Republic","De La Cruz has a power forward's build at 6-foot-8 and is an extreme power projection long shot. He runs well enough underway that there's a faction of scouts who think he might stay in center field, which would take some pressure off the swing-and-miss profile. The selectivity is the thing that really needs to improve here.",,"sa3006903"
"Hsin-Chieh Lin","PHI","RHP","A-",,39,,"35+",2023,,"21.3222222","6' 2""","225","R","R",2018,"J2","PHI",250000,"Taiwan","Lin is a giant 20-year-old with huge, broad shoulders and a softer build. He has ""reverse projection,"" meaning he's young enough to reshape an otherwise unprojectable build and add velocity through improved conditioning. Philly has targeted heavier-bodied pitchers in international free agency (Castillo, Morales, Santos) and Lin is another. His delivery is fairly loose and fluid, especially for his size. The secondary stuff is raw, but Lin had a strong statistical 2019 in a three-ish inning piggyback role with Williamsport.","WkzSCox18dI","sa3008535"
"Rixon Wingrove","PHI","1B",,,40,,"35+",2023,,"20.1416666","6' 5""","260","L","R",2017,"J2","PHI",,"Australia","Wingrove repeated the GCL in 2019 and hit .298/.374/.500. He's a huge lefty power bat who obviously needs to hit a ton to profile since he's a heavy-footed, 1B/DH prospect. His Aussie background gives him a pass for that first summer and makes the level repeat less of a red flag, but he still has little margin for error.",,"sa3007298"
"Baron Radcliff","PHI","1B",,,41,,"35+",2024,,"21.325","6' 4""","220","L","R",2020,"Draft","PHI",,"Georgia Tech","Philly drafts a big college 1B like this most years, a guy with huge power who has performed at a bigger school. Radcliff's limited bat-to-ball skills make the 1B profile very dicey, but he certainly has the power for it.",,
"Manuel Silva","PHI","LHP",,,42,,"35+",2021,,"21.5722222","6' 2""","145","L","L",2015,"J2","PHI",100000,"Dominican Republic","I officially have one foot in, one foot out on Silva. His frame, his mechanical grace and fluidity, and his feel for locating average secondary stuff are still positives, but the clock is ticking on the body and fastball projection. The command and secondary quality aren't good enough to support the profile without more heat.",,"sa917865"