"Logan Driscoll","TBR","C","A-",,53,,"35+",2023,,"22.6972222","6' 1""","195","L","R",2019,"Draft","SDP",600000,"George Mason","Driscoll is an athletic catcher who has the physical tools to stick behind the plate, but he is still pretty raw and faced mid-major competition in college. He's an older developmental project.",,"sa3009882"
"Victor Munoz","TBR","RHP","R",,54,,"35+",2022,,"19.5527777","6' 4""","170","R","R",2017,"J2","TBR",442000,"Dominican Republic","There was no velo bump for Munoz in 2019, who remains a good-framed teenage projection arm in the low-90s with some feel for spinning a curveball.",,"sa3006381"
"Alberto Figuereo","TBR","2B","R",,55,,"35+",2022,,"20.2222222","5' 9""","145","S","R",2017,"J2","TBR",,"Dominican Republic","Like so many of the hitters in this system acquired from both the international and domestic markets, Figuereo is a contact-oriented middle infielder with a small frame. He's behind similarly-aged players in the system like Alejandro Pie (physical projection) and Abiezel Ramirez (present physicality, a level ahead), but has a speed/contact foundation that gives him a reasonable utility infield outcome with a shot to hit enough for regularity.",,"sa3005583"
"Daiveyon Whittle","TBR","RHP","A-",,56,,"35+",2023,,"20.675","5' 11""","235","R","R",2018,"Draft","TBR",100000,"Fresno City JC (CA)","A Rubenesque junior college righty, Whittle signed for $100,000 as a 2018 23rd rounder and had a velo spike in 2019. He's now 89-92 with heavy sink (an over 60% groundball rate this year) and a good splitter, as well as a passable slider. He's quite athletic and gets down the mound well for a 5-foot-11 guy, and he lives around the zone. It's probably important that Whittle's stuff keep improving, but it's trending up enough now that he's popped onto the radar.",,"sa3007617"
"Michael Mercado","TBR","RHP","A-",,57,,"35+",2022,,"21.2472222","6' 4""","160","R","R",2017,"Draft","TBR",2132400,"Westview HS (CA)","Mercado had surgery last May and picked up a baseball again in October. He hadn't had the velocity uptick you'd hope a high school draftee his size would have once turning pro, but he's still barely 21 and has a prototypical starter's frame and some curveball feel.",,"sa3005024"
"Jayden Murray","TBR","RHP","A-",,58,,"35+",2023,,"23.2583333","6' 1""","190","R","R",2019,"Draft","TBR",3000,"Dixie State","Murray was a $3,000 senior sign but it quickly became apparent in pro ball that he had workable stuff because of his ability to spin the baseball. After working three or fewer innings at a time for the first several weeks after he signed, the Rays took the reigns off late in August and Murray turned in some fantastic starts, including a 10 strikeout, one hit, six-inning outing to close out the season. He's a spin rate sleeper.",,"sa1170405"
"Angel Felipe","TBR","RHP",,,59,,"35+",2022,,"22.8722222","6' 5""","190","R","R",2015,"J2","TBR",,"Dominican Republic","Felipe remains quite raw as a strike-thrower and he's spent a very long time in rookie ball, but he has a chance to have a dominant pitch in the fastball because of the combination of its velo and supporting traits.",,"sa881181"
"Carlos Garcia","TBR","RHP","A+",,60,,"35+",2023,,"21.6277777","6' 3""","185","R","R",2017,"J2","TBR",,"Dominican Republic","Garcia bullied Winter League hitters in Australia with a three-pitch mix, all of which flash 55 on the scale. He's a softer-bodied, relief-only prospect.",,"sa3006590"