"Nick Schnell","TBR","CF","A",,19,,"40+",2023,,"20.2972222","6' 3""","185","L","R",2018,"Draft","TBR",2300000,"Roncalli HS (IN)","Schnell was a cold-weather high school hitter who went bonkers during his senior year, especially during the varsity postseason, which was late in the spring and closer to the draft when high-level scouts were coming in for looks. Based on his physical tools -- chiefly, the power and straight-line speed -- and body projection, Schnell has big upside. He's shown opposite field thump, which impresses some scouts though others argue his inside-out contact spray indicates a swing flaw. To possess premium bat speed and face pitching in the 80s but still inside-out home runs suggests that Schnell has been late on subpar stuff, and his deep hand load, which helps create the power, also creates a ton of length back to the ball. It's still too early to say definitively that this is a problem, in part because Schnell hasn't played many pro games yet due to injuries, which he has a history of (a broken bone in his right wrist in 2018, minor surgery on his right knee in April of 2019 to correct an ailment he described as stemming from wear and tear). He's a high-variance corner outfield power projection prospect.","ISk4togAcBA","sa3007639"
"Pete Fairbanks","TBR","RHP","MLB",,21,,"40+",2020,,"26.5777777","6' 6""","220","R","R",2015,"Draft","TEX",90000,"Missouri","Fairbanks has elite, late-inning stuff that arrived after he returned from the second of two Tommy Johns and shifted to the bullpen in 2019, a move that helped enable a fastball bump from the 92-94 range to 95-98, touching 100. That fastball has big carry/rise thanks to its spin rate (nearly 2500 rpm) and spin axis; it backspins due to Fairbanks' slot, and his slider has vertical, curveball-shaped break but rests in the upper-80s and low-90s. This is an impact relief piece who is ready right now, though age and Fairbanks' injury history round the FV down a bit.",,"17998"
"Kevin Padlo","TBR","3B",,,22,,"40+",2020,,"23.9972222","6' 2""","205","R","R",2014,"Draft","COL",650000,"Murrieta Valley HS (CA)","After undergoing some swing alterations -- there have been a few changes to how open Padlo's stance is and how big his leg kick is -- and gutting through a terrible April and May, Padlo became a pull and lift machine for the final few months of the season. It's a one-note approach that might be pitched around effectively at the big league level, but to this point Padlo has shown to be selective enough to wait for pitches he can yank that way. His slugging performance is up over what's realistic at the big league level but there is relevant big league power output now. I think Padlo is too heavy-footed to play third base every day but industry opinions are mixed. I think he's ticketed for a four corner platoon role of some sort, similar to the one Rays fans have seen Yandy Díaz occupy.",,"sa828961"
"Abiezel Ramirez","TBR","SS","R",,23,,"40+",2022,,"20.4666666","5' 11""","175","S","R",2016,"J2","TBR",300000,"Dominican Republic","Two years in the DSL means Ramirez's 40-man timeline is compressed, and that's especially true now that the spread of COVID-19 has shortened the 2020 season, Ramirez's last before being Rule 5 eligible. Based on his physicality (Ramirez is a curvaceous, José Ramírez type scaled up to 5-foot-11) and relatively advanced feel to hit, Abiezel was a candidate to be pushed quickly this year to stress test the bat. Ramirez has a handsy, powerful swing that produces whizzing line drives from the left side of the plate. His arm strength fits on the left side of the infield and gives him a shot to stay at short. Barring a swing change or feel for lift that develops naturally as he matures, this is likely to be more of a doubles-oriented power profile, but the bat-to-ball skills may carry him to an everyday infield role even if there's no change there.",,"sa3003282"
"Ford Proctor","TBR","SS","A",,24,,"40",2022,,"23.6111111","6' 1""","195","L","R",2018,"Draft","TBR",572500,"Rice","It's prudent to be skeptical of Proctor's 2019 Low-A statline because of his age, and he doesn't have the overt physical tools easy to scout in a short look, but he has a carrying tool in his lefty stick and has a shot to stick at shortstop. He's done nothing but hit dating back to his freshman year at Rice -- Proctor is a .300/.392/.420 hitter, combined college and pro -- and I'm confident he's a high-contact and OBP middle infielder, which, even without impact power, is still a big league role player.",,"sa876187"
"Riley O'Brien","TBR","RHP","AA",,25,,"40",2021,,"25.4388888","6' 4""","190","R","R",2017,"Draft","TBR",,"Idaho","O'Brien's velocity has climbed each of the last two years and now rests comfortably in the mid-90s, with an extra tick of perceived velo due to extension. He's a classic small-school late bloomer with a good frame and athletic delivery. O'Brien also has an abnormally firm, sinking, upper-80s changeup, and a power, low-80s curveball, both of which look like impact pitches at times. It's starter stuff, and perhaps more traditional starter's control will develop late, much like O'Brien's stuff has.",,"sa3004210"
"Moises Gomez","TBR","RF","A+",,26,,"40",2022,,"21.8805555","5' 11""","200","R","R",2015,"J2","TBR",40000,"Venezuela","I'm staying on Gomez despite a) his precipitous 2019 downtick in production and b) his terrifying, swing-happy, corner-only profile. He has nautical mile power and sneaky good plate coverage that's masked by how often he chases. Despite his maxed frame (he began his pro career as a speedy center field prospect but now has a chonky corner build), Gomez is an athletic swinger who can punish pitches out away from him to center and right-center field, and can also turn on stuff on the inner half and send it skyward. He has heart-of-the-order talent that's currently at the mercy of an immature approach, so callow that he was passed over in last year's Rule 5. He's a high-variance player at the mercy of his own decision-making.","z10zQ90DBo4","sa875163"
"Jhon Diaz","TBR","CF",,,27,,"40",2025,,"17.7861111","5' 11""","180","L","L",2019,"J2","TBR",1500000,"Dominican Republic","The Yankees' all-in pursuit of Jasson Dominguez enabled the Rays to swoop in and offer Diaz more money than New York could trade for in pool space; Tampa inked him for $1.5 million. Diaz has more present skill than he does physical projection, atypical for the July 2 market. There are teams that considered him a tweener fourth outfield type, but I think he's just short, not small, and has a bunch of above-average tools and good baseball instincts. His path to an everyday role involves him staying in center field and making a lot of contact. If he falls short at either, <em>then</em> we're talking about a platoon/fourth outfielder type.","e4kObJjybzc",
"Lucius Fox","TBR","SS",,,28,,"40",2021,,"23.0333333","6' 1""","175","S","R",2015,"J2","SFG",6000000,"Bahamas","Somehow, despite his relative lack of power, the most consistent aspect of Fox's performance has been on the offensive end of things. As reports of the quality of his defense have waxed and waned over the last three years, he's somehow posted an above-average offensive line for each of the last three affiliates at which he's spent most of the season. That includes a 104 wRC+ in a depressed 2019 Southern League, where the average hitter's line was .243/.318/.366. Despite major league-average exit velocities, Fox's contact quality isn't great, and he has an OBP-driven offensive profile thanks to his keen eye for the zone. 
He'd need to be a plus shortstop defender to profile as a low-end regular, and while he has looked like it at times, it hasn't been consistent, and the Rays began moving him all over the infield late last year. As a switch-hitter who's better from the right side (his numbers have been much better as a righty bat the last couple years), I think Fox will play some sort of multi-positional, shorter half of a platoon role while also pinch running. If you think he's a low-end regular at short, then he's a 45 FV, but I think it'll be hard for him to be more than a 1-WAR role player without any impact in the bat.","9De92or9Lp8","sa914200"
"Drew Strotman","TBR","RHP","A+",,29,,"40",2021,,"23.8638888","6' 3""","195","R","R",2017,"Draft","TBR",367500,"St. Mary's","In many ways, the first half of Strotman's 2018 season was just like that of Phillies righty Spencer Howard. Like Howard, Strotman mostly pitched out of the bullpen at a second tier California college and only began starting full-time in 2018. He was probably slightly underscouted as an amateur, and definitely underdeveloped. For a month and a half of 2018, he showed mid-rotation stuff, then blew out his elbow and needed Tommy John. His rehab was slow and Strotman was 90-93 when he returned, then 91-95 with average secondary stuff late in the Fall League. He looked like a No. 4 starter before the injury (he was 92-97 at that point) and now looks like a backend arm, but based on how his stuff was trending in the Fall, he might be very relevant later this year.",,"sa3004584"
"John Doxakis","TBR","LHP",,,30,,"40",2022,,"21.9","6' 4""","215","L","L",2019,"Draft","TBR",1130000,"Texas A&M","Doxakis works 88-92 with solid average stuff as a pitchability lefty who can eat innings. His slider has great whiff rates in the zone, which gives him a high floor as a reliever, possibly a multi-inning one, who can work through a lineup with heavy use of his breaking stuff. The shape of his fastball should theoretically pair well with a changeup, but Doxakis sometimes lacks feel for his change, a firm, mid-80s offering that has very little spin and has a chance to be an impact pitch. He's a backed starter if that pitch develops.",,"sa1115967"
"Ian Seymour","TBR","LHP",,,31,,"40",2023,,"21.5861111","6' 0""","190","L","L",2020,"Draft","TBR",,"Virginia Tech","It's possible I over-attribute certain player archetypes to teams like Tampa, who collect so many prospects that they're bound to have a couple clusters of similar guys, but they sure do seem to like these deceptive lefties who have fastballs with tail rather than carry. It's as if they have a six-year plan to stream internal options for the Ryan Yarbrough role, in which Seymour projects. He has a wild head whack but throws strikes anyway, his fastball has tail/sink and its movement mirros his changeup's, plus he has a really long, two-planed breaking ball that works versus lefties, and if it's well-located versys righties. He projects as a backend starter or long reliever.",,
"Michael Perez","TBR","C","MLB",,32,,"40",2020,,"27.9361111","5' 11""","180","R","R",2011,"Draft","ARI",235000,"Colegio Vocacional Para Adultos HS (PR)","I expect Perez will win the Rays backup catching job if and when we have a baseball season, and he would have graduated from this list last year had he not missed a lot of time rehabbing a hamstring strain. He is an athletic catcher with a plus arm, average receiving skills, and some feel to hit. After struggling to perform with the bat during the first several years of his career, Perez has now had three straight seasons of at least league-average offensive performance at Double- and Triple-A. He has a pull-and-lift style of hitting, but not enough raw power to optimize that kind of approach. He's a safe bet to be a quality backup and has a non-zero chance to hit a little more than I expect and end up a low-end regular.",,"12977"
"Anthony Banda","TBR","LHP",,,33,,"40",2020,,"26.9277777","6' 2""","190","L","L",2012,"Draft","MIL",950000,"San Jacinto JC (TX)","It's been a long and winding road for Banda, who has been traded twice -- Milwaukee sent him and Mitch Haniger to Arizona for Gerardo Parra in 2014, and then in 2018, Banda was part of the massive, three-team trade involving Steven Souza and Brandon Drury, among others -- and finally looked like he'd get a long-term big league look in 2018. He was 10 innings shy of exhausting rookie eligibility when he tore his UCL and had Tommy John in early June, which shelved him until the very end of the 2019 season. He's still a big league arm for me, probably a fastball/changeup reliever, but he had No. 4 starter stuff when he was healthy. His age and lack of roster flexibility might force his role to be whatever Banda is capable of handling immediately upon baseball's return.",,"14706"
"Curtis Mead","TBR","2B","R",,34,,"40",2023,,"19.7166666","6' 2""","170","R","R",2017,"J2","PHI",200000,"Australia","Mead, a 19-year-old Australian infielder, is an interesting developmental project for the Rays, who acquired him from Philadelphia for 40-man crunch reliever Cristopher Sanchez. Mead signed with just a few weeks left on the 2017 July 2 calendar and only played four games during the summer of 2018 before picking up at-bats during instructional league. While my scout and front office sources describe him as being raw, Mead performed surprisingly well — .285/.351/.462 with a 13% strikeout rate — against what was almost certainly the best pitching he’d ever seen. Rookie-level stats aren’t a reliable means of evaluation on their own, but in this case, they underscore a surprising level of competence given Mead’s inexperience. 
The international and pro scouting sources I tapped mentioned Mead's very projectable, 6-foot-2 frame first. He has power projection because of the frame and a fairly advanced hit tool given his background. He played shortstop as an amateur in Australia and all over the infield in 2019. Based purely on how he looks right now, Mead projects as a corner outfielder, but there may be more room for growth — better footwork and actions — as he accrues reps.",,"sa3008392"
"Michael Plassmeyer","TBR","LHP","AAA",,35,,"40",2022,,"23.6916666","6' 2""","192","L","L",2018,"Draft","SEA",425000,"Missouri","Another Day 2 college pitcher quickly flipped by the Mariners, Plassmeyer (who was part of the Mallex Smith/Mike Zunino deal) spent most of his first full pro season at Hi-A, where he walked just 16 hitters in 101.2 innings. Like many of the lefty pitchers the Rays seem to like for the org's change of pace, bulk relief role, Plassmeyer's fastball has a lot of lateral action because of his lower slot. He works his fastball in on righties (it has tough angle) and sometimes tails it off the plate away from them for swinging strikes. He can back foot his breaking ball consistently and his changeup has sufficient fade to miss bats. This is an elite pitchability lefty with very average stuff who I think ends up in the Yarbrough role.",,"sa3006962"
"Alika Williams","TBR","SS",,,36,,"40",2023,,"21.3388888","6' 2""","180","R","R",2020,"Draft","TBR",,"Arizona State","Williams is an acrobatic defensive shortstop with great feel for contact. His swing is unique, perhaps a result of habits Williams has gotten into while trying to lift the baseball despite a relative lack of physicality. He swings a lot like Zack Greinke, cheating for power middle-in, able to put balls in play all over the place. I don't think Williams will hit for enough power to be an everyday player but he's a likely utility man.",,
"Tristan Gray","TBR","1B","AA",,37,,"40",2020,,"24.3111111","6' 3""","185","L","R",2017,"Draft","PIT",125000,"Rice","Like Ford Proctor a few spots higher on this list, Gray was a three-year starter at Rice as a middle infielder and likely projects as a utility guy at the next level, though Gray is more of a shift-aided infielder who fits best at first base and can moonlight at others rather than a guy who's primarily a middle infield fit. To contrast with Proctor, Gray was a lankier-framed prospect who has slowly filled out and added noticeable loft to his swing last year, so there's more impact with the bat than there is with Proctor. He's a lefty infield platoon type similar to 2019 Rule 5 pick Vimael Machin.",,"sa829756"
"Tanner Dodson","TBR","RHP","A+",,38,,"40",2021,,"23.1805555","6' 1""","170","S","R",2018,"Draft","TBR",775000,"Cal","The addition of a 26th man to active rosters makes it less likely that someone like Dodson sees actual time as an outfielder, as teams now have the roster room to house someone who is both better at the things Dodson does as a positional player (he switch-hits, has contact feel from the left side, and throws and runs well) and can also do something else. I think it's more likely he ends up a two-pitch reliever who only plays the field or hits in case of emergency. Three-batter minimums make obsolete the scenario where Dodson faces a hitter then plays center for a hitter or two before re-entering the game.","a723taF8Ipw","sa3007008"
"Joel Peguero","TBR","RHP",,,39,,"40",2021,,"23.1916666","5' 11""","160","R","R",2015,"J2","TBR",,"Dominican Republic","Peguero is a late-blooming power arm who took a step forward stuff-wise in 2018, then continued to pitch effectively out of Bowling Green's bullpen in 2019, typically in two-inning outings. It's a burgeoning, two-pitch relief profile.",,"sa917689"
"Hunter Barnhart","TBR","RHP",,,40,,"40",2025,,"18.4166666","6' 2""","195","R","R",2020,"Draft","TBR",,"St. Joseph HS","Has been up to 94 with life in the zone and will flash a  60 curveball, but struggles to repeat/command. Relatively mature build for his age. Might have two plus pitches out of the bullpen, though.",,
"Resly Linares","TBR","LHP","A+",,41,,"40",2022,,"22.5916666","6' 2""","170","L","L",2014,"J2","TBR",275000,"Dominican Republic","Linares made it through just six 2019 innings before he blew out and needed Tommy John. He's a low-slot lefty with a great breaking ball and a skinny frame that hasn't filled out very much. His surgery was early enough that he's likely to be back sometime in 2020, assuming baseball is. Where his velo is coming out of rehab will dictate if he moves up or down this list.",,"sa873296"
"Brian O'Grady","TBR","CF",,,42,,"35+",2020,,"28.1583333","6' 2""","215","L","R",2014,"Draft","CIN",10000,"Rutgers","O'Grady is an older prospect who wasn't given an opportunity to supplant Billy Hamilton in Cincinnati and found his way to the Rays via a small trade for cash or a PTBNL. I think he has big league tools. His 2019 power output was aided by the Triple-A ball but he has above-average raw power and straightline speed. He's an interesting 1B/OF (including center) lefty-hitting bench piece.",,"16729"
"Esteban Quiroz","TBR","2B",,,43,,"35+",2020,,"28.4083333","5' 7""","175","L","R",2017,"J2","BOS",,"Mexico","Quiroz was Team Mexico’s leadoff hitter during the 2017 WBC (he hit two homers and a double in six at-bats) and spent 2015-'17 crushing the Mexican League. He signed with Boston in November 2017, and was hot the following April at Double-A, but then missed three and a half months with an abdominal strain. He only played in 24 games at Double-A, then had 62 extra plate appearances in the Arizona Fall League, where he played well and was seen by the entire pro scouting community. San Diego traded a 40-man crunch relief arm to Boston for Quiroz, then later flipped him to Tampa Bay as part of the Tommy Pham deal. 
This is a very Rays sort of prospect. He has deft, all-fields contact ability and can (kind of) play an up-the-middle position. Quiroz presents rare 40-man flexibility because he's arguably ready to contribute to a big league lineup right now, but because of how recently he signed, he doesn't have to occupy a 40-man spot until this December. He can act as viable upper-level depth without occupying a 40-man spot. He lacks the defensive versatility to play a long term bench role but it woudln't surprise me if he ended up being a low-end second base regular for someone for a couple seasons.",,"sa596560"
"Graeme Stinson","TBR","LHP","R",,44,,"35+",2023,,"22.9388888","6' 5""","245","L","L",2019,"Draft","TBR",444400,"Duke","At one point, Stinson had the nastiest two-pitch combo in his draft class. As a sophomore mostly-reliever at Duke and during the following summer, he worked with two 70-grade pitches in his mid-90s heater and 3000 rpm slider. The following spring, Stinson was set to get his first extended look in the rotation but his velocity was mostly in the 80s without a clear reason. He was quickly shut down for the remainder of the college season, though specifics regarding the injury were not divulged at the time; sources have indicated to FanGraphs it was a nerve issue that may not require surgery. Stinson made just one appearance after he signed and sat 88-90. He has high-leverage relief potential with good health.",,"sa3011900"
"Sandy Gaston","TBR","RHP","R",,45,,"35+",2023,,"18.5777777","6' 0""","190","R","R",2018,"J2","TBR",2610000,"Cuba","Gaston was a 15-year-old Cuban defector who, right around his 16th birthday, hit 100 mph while working out for teams. That nearly unprecedented velocity for his age obviously garnered a lot of attention in the scouting community, though Gaston often had 20 control when he scraped triple digits. He also isn't classically projectable -- his velocity is already at the top of the scale and he has a maturely-built frame at 6-foot, but he's done some arm slot and arm action tinkering over the last few years that has affected his control and command. So while Gaston may get stronger as he physically matures, what's more important is the projection of his feel for pitching, which appears to be more natural at a three-quarters arm slot with velocity more in the mid-90s, where his arm action is also more naturally online, than the higher slot where he was throwing harder and wilder. 
Gaston's best pitching performance was as the main event on the mound at the Víctor Víctor Mesa workout in Marlins Park, where the better version of his arm slot, arm action, and control was first seen by a large scouting audience. It didn't hold. Gaston walked a batter per inning in his first pro season while sitting in the 93-97 range with the fastball. He's a teenage relief prospect at this point.","PB7HrCsfEUU","sa3011136"
"Jelfry Marte","TBR","SS","R",,46,,"35+",2023,,"19.2972222","5' 10""","165","S","R",2017,"J2","TBR",820000,"Dominican Republic","Marte originally signed with the Twins for $3 million as one of the top position players in the 2017 July 2nd class. That deal was voided over concerns about Marte's vision, but they weren't as strong as they were for the last prospect who went through a situation like this, Dominican power-hitting right fielder Wagner Mateo. Mateo signed for $3.1 million with St. Louis in 2009, and after his deal was voided, signed with Arizona for $512,000 almost a year later. He played parts of four seasons before being released by the D-backs, having only appeared in 10 games in a full-season league, with a career .660 OPS. 
Marte ended up signing with Tampa Bay less than a month after his deal was voided, this time for $820,000; Tampa Bay saw his vision as a correctable issue. Early looks in pro ball (Marte's first fall instructs) were positive, but his performance since then has been concerningly bad. The eyeball reports of the physical talent, defense, and speed are still strong, but Marte officially has the contact red flags you'd expect someone with vision issues to exhibit.",,"sa3006886"
"Niko Hulsizer","TBR","LF","A+",,47,,"35+",2022,,"23.4527777","6' 2""","225","R","R",2018,"Draft","LAD",125000,"Morehead State","The yoked Pennsylvanian became notable when he hit 27 homers as a sophomore at Morehead, but he became legendary when one of them left Choccolocco Park (the Ohio Valley Conference's tournament site) and hit a fire engine parked well beyond the outfield fence. Hulsizer had a down junior year amid a broken hand but has been mashing since he's been in pro ball, albeit a level or two below what is typical for prospects his age. He's a potential three-true-outcomes corner masher.",,"sa3007053"
"Cal Stevenson","TBR","CF","A+",,48,,"35+",2021,,"23.8388888","5' 10""","175","L","L",2018,"Draft","TOR",5000,"Arizona","Stevenson is relatively positionless but he has great contact and on-base skills. His numbers are likely inflated due to his age relative to the level, but the industry undervalued him during his draft year because of injury, so it's possible we're seeing something closer to the real Stevenson now. He's already been traded twice (from Toronto to Houston, then Houston to Tampa Bay), so clearly teams are interested in him. I think he's a fourth outfield prospect but he's performing like a table-setting leadoff hitter.",,"sa3006871"
"Colby White","TBR","RHP","A-",,49,,"35+",2023,,"22.0277777","6' 0""","190","R","R",2019,"Draft","TBR",197500,"Mississippi State","White is a power relief prospect with a violent delivery. He spent two years at Pearl River Community College, then transferred to Mississippi State, where he dominated, striking out nearly two batters per inning. He's of the vertical fastball/breaking ball variety.",,"sa3011200"
"Audry Lugo","TBR","RHP","A-",,50,,"35+",2023,,"21.7083333","5' 11""","160","R","R",2018,"J2","TBR",,"Dominican Republic","A short, athletic righty with a high arm slot, Lugo pairs a mid-90s fastball and power curveball in a two-pitch relief profile. Of all the hard-throwing arms in this tier of the system, Lugo has the best combination of stuff and athleticism.",,"sa3008710"
"Neraldo Catalina","TBR","RHP","R",,51,,"35+",2023,,"20.0638888","6' 6""","202","R","R",2018,"J2","NYM",150000,"Dominican Republic","Acquired as the PTBNL in the Wilmer Font trade, Catalina is a huge-framed teenage righty up to 97. He has some Domingo Acevedo flavor to the delivery and a lower arm slot, so he's likely a reliever.",,"sa1172730"
"Aneudy Cortorreal","TBR","RHP","R",,52,,"35+",2023,,"20.5861111","6' 3""","200","R","R",2018,"J2","TBR",,"Dominican Republic","Like Catalina, Cortorreal is a big-bodied, arm strength developmental project whose heater took a leap when he reconfigured his physical conditioning heading into 2019.",,"sa3009242"
